title,time
天皇陛下が晩餐会でビオラ演奏　モンゴルの伝統楽器・馬頭琴と共演,2025年7月8日 22時15分
車で避難可能地域を設定へ　津波対策で大船渡市　国道に通行止め区間,2025年7月8日 20時30分
安倍元首相銃撃事件3年、現場で1700人悼む　石破首相は慰霊碑へ,2025年7月8日 20時00分
店にクマ、ガラス戸突き破って逃げる　遭遇の男性「目が合った気が」,2025年7月8日 20時00分
仙台白百合女子大、27年に共学化へ　入学者数減少、定員割れ踏まえ,2025年7月8日 19時54分
西武池袋本店が9日改装開業、化粧品売り場拡大　「再び池袋の顔に」,2025年7月8日 18時17分
小林製薬、自社サイトでの通販事業から撤退　他社経由で通販は継続,2025年7月8日 17時41分
「古米をおいしく」、コメ高騰で炊飯器に注目　家庭用精米機も人気に,2025年7月8日 16時45分
日経平均、101円高の3万9688円　米関税発動「8月から」好感,2025年7月8日 16時30分
日産、転換社債の発行額を500億円増　調達総額は8千億円の見込み,2025年7月8日 16時22分
参政公約「終末期延命措置は全額自己負担」　神谷氏「啓発する思い」,2025年7月8日 21時40分
外国人政策、参院選の論点に浮上　対応の厳格化、共生強調…違い鮮明,2025年7月8日 20時59分
「一番好きな政党」、参政党はほぼ横ばい　朝日・阪大ネット意識調査,2025年7月8日 18時00分
「悲願」の三鉄通勤実現　元市職員の新宮古市長、先輩職員に気遣いも,2025年7月8日 17時00分
参政・神谷代表「『日本人ファースト』はニーズあったのでは」と持論,2025年7月8日 17時00分
国際刑事裁、タリバン最高指導者らに逮捕状発行　女性迫害めぐり,2025年7月9日 2時30分
韓国も猛暑、ソウル37.8度　7月上旬の最高気温を86年ぶり更新,2025年7月8日 22時31分
米、シリアHTSの「外国テロ組織」指定を解除　英も国交回復,2025年7月8日 21時30分
ユネスコ、韓国の訴え退ける　明治産業遺産めぐり,2025年7月8日 21時15分
韓国は関税交渉加速に意欲、首脳会談も視野　トランプ氏の25%方針,2025年7月8日 20時11分
夏の高校野球宮城大会、きょう開幕　「エール届けたい」開会式リハ,2025年7月9日 2時36分
高校野球岩手大会9日開幕　マネジャー2人が開会式リハに臨む,2025年7月9日 2時34分
冬の練習で柱に成長、今度は完投できた　日工大駒場の関田拓真投手,2025年7月8日 20時18分
華麗な守備でリズム、三塁打も放つ　東大津の宮内選手が攻守で躍動,2025年7月8日 19時50分
芝浦工大付・荒木孝多選手「打席にわくわく」　適時三塁打で勝利貢献,2025年7月8日 19時44分
日本アニメ、米国で「クール！」に熱狂　配信とリアルで市場拡大中,2025年7月8日 14時00分
生成AI「使い道わからない」日本は利用に消極的　情報通信白書公表,2025年7月8日 11時01分
「私はゲームを盗まれた」　「聖地」で線審廃止　機械作動せず物議,2025年7月8日 9時00分
伊与原新さんが感銘受けた低予算研究計画　天文小説の元ネタを味わう,2025年7月8日 7時00分
生成AIの大統領ニセ動画、国民が詐欺被害　画面上の友人は本物？,2025年7月8日 5時00分
ユネスコ、韓国の訴え退ける　明治産業遺産めぐり,2025年7月8日 21時15分
原爆投下の映像、広島と長崎を取り違えて放送　テレビ朝日社長が謝罪,2025年7月8日 21時00分
NHK次期会長の選考へ部会発足　委員長「政権が決める話ではない」,2025年7月8日 17時00分
コンクリートだけを踏みつつ六十九年　迢空賞受賞者のはな子への思い,2025年7月8日 14時00分
熱中症を防ぐため、新装置を発明した！　地球防衛家のヒトビト214,2025年7月8日 13時30分
サイコロみたい？見て楽しむ四角いスイカ　香川・善通寺で出荷始まる,2025年7月8日 10時30分
1～6月の訪問介護事業者の倒産、過去最多更新　報酬引き下げ影響か,2025年7月7日 16時04分
「時給10円」は本当か　コメ農家100軒の懐事情から見た適正価格,2025年7月7日 10時00分
孫の遺品が結ぶ縁　能登で被災の輪島塗職人、支援イベントで漆器販売,2025年7月6日 19時00分
閉店が決まったカフェ、常連客の「忘れ物」　29歳店長の新たな門出,2025年7月6日 16時00分
6度目の挑戦で暗算10段に合格　中1生徒が週2回の通塾で難関突破,2025年7月8日 16時00分
輸入品に関税 どんな影響があるの？　相手国との貿易摩擦生むおそれ,2025年7月8日 10時00分
「人生はプラス思考以外ない」　母がルーズリーフに込めた最後の手紙,2025年7月8日 8時00分
闇バイト「小学生の時から気をつけて」　警視庁練馬署が呼びかけ,2025年7月7日 20時30分
群馬県吹奏楽連盟の職員が不適正な会計処理　約1650万円が不明に,2025年7月7日 19時15分
ミャンマーで誕生、難病の赤ちゃんを救え　信じて支える日本人社会,2025年7月8日 17時30分
傷に塗る遺伝子治療薬、承認へ　皮膚もろい難病「表皮水疱症」が対象,2025年7月7日 20時54分
1～6月の訪問介護事業者の倒産、過去最多更新　報酬引き下げ影響か,2025年7月7日 16時04分
若い初産女性、頼れる人「6人以上必要」　産後うつリスク低減のため,2025年7月7日 16時00分
化学物質過敏症でお困りの方、訪問美容師がご自宅までうかがいます,2025年7月7日 10時00分
将棋の糸谷哲郎八段　これからは「恩を返す時代」　次世代の学び応援,2025年7月8日 12時00分
芝野虎丸十段が5勝目、挑戦圏内に踏みとどまる　囲碁名人リーグ,2025年7月7日 21時30分
振り飛車党39年の斎田晴子女流五段が引退　「これからは居飛車党」,2025年7月7日 20時00分
「勝てると思わず」　小学生の時以来の対戦も　将棋朝日杯プロアマ戦,2025年7月5日 11時00分
将棋連盟新会長が初昇級「ビックリ」　就任1カ月の清水市代女流七段,2025年7月4日 18時49分
「おもろいやろ」夢に巻き込む悪ガキ少年、フィギュアの海洋堂創業者,2025年7月8日 6時00分
あしなが育英会会長の玉井義臣さん死去　90歳　遺児支援に尽力,2025年7月6日 17時50分
「草刈り十字軍」創始者の足立原貫さん死去　除草剤散布に反発し運動,2025年7月3日 10時00分
ユーロスペース代表の堀越謙三さん死去　カラックス映画など製作配給,2025年6月27日 16時00分
指揮者の村川千秋さん死去、92歳　山形交響楽団を創設,2025年6月26日 16時15分
scraped at,2025-07-08 19:23:19,
-----------------------
